{
  "$schema": "../../schema/viz-v1.schema.json",
  "version": 1,
  "name": "Neon Tunnel",
  "author": "Spiral",
  "description": "Fly through a reactive neon ring tunnel.",
  "surfaces": {
    "default": {
      "scene": [
        {
          "id": "tunnel",
          "kind": "webgl",
          "layout": "fill",
          "renderer": "neon-tunnel",
          "params": {
            "ringCount": 50,
            "tunnelSpeed": 1.2,
            "glow": 0.9,
            "particleDensity": 0.3,
            "bassPulse": 0.85
          }
        }
      ]
    },
    "mini": {
      "scene": [
        {
          "id": "tunnel",
          "kind": "webgl",
          "layout": "fill",
          "renderer": "neon-tunnel",
          "params": {
            "ringCount": 36,
            "tunnelSpeed": 1.0,
            "glow": 0.8,
            "particleDensity": 0.2,
            "bassPulse": 0.75
          }
        }
      ]
    },
    "expanded": {
      "scene": [
        {
          "id": "tunnel",
          "kind": "webgl",
          "layout": "fill",
          "renderer": "neon-tunnel",
          "params": {
            "ringCount": 58,
            "tunnelSpeed": 1.4,
            "glow": 1.0,
            "particleDensity": 0.35,
            "bassPulse": 0.9
          }
        }
      ]
    }
  },
  "reducedSurfaces": {
    "default": {
      "scene": [
        {
          "id": "tunnel",
          "kind": "webgl",
          "layout": "fill",
          "renderer": "neon-tunnel",
          "params": {
            "ringCount": 30,
            "tunnelSpeed": 0.5,
            "glow": 0.7,
            "particleDensity": 0.2,
            "bassPulse": 0.5
          }
        }
      ]
    }
  }
}
